{
  "$schema": "https://json-schema.org/draft/2020-12/schema",
  "$id": "https://contracts.instant-ppt.example/v1/PresentationRevision.schema.json",
  "title": "PresentationRevision",
  "type": "object",
  "additionalProperties": false,
  "properties": {
    "schemaVersion": {
      "type": "integer",
      "const": 1
    },
    "presentationId": {
      "type": "string",
      "pattern": "^[0-9A-HJKMNP-TV-Z]{26}$"
    },
    "presentationRevisionId": {
      "type": "string",
      "pattern": "^[0-9A-HJKMNP-TV-Z]{26}$"
    },
    "basedOnRevisionId": {
      "anyOf": [
        {
          "type": "string",
          "pattern": "^[0-9A-HJKMNP-TV-Z]{26}$"
        },
        {
          "type": "null"
        }
      ]
    },
    "organizationId": {
      "type": "string",
      "pattern": "^[0-9A-HJKMNP-TV-Z]{26}$"
    },
    "slideVersionIds": {
      "type": "array",
      "minItems": 1,
      "items": {
        "type": "string",
        "pattern": "^[0-9A-HJKMNP-TV-Z]{26}$"
      },
      "uniqueItems": true
    },
    "acceptedMissingSlideIds": {
      "type": "array",
      "items": {
        "type": "string",
        "pattern": "^[0-9A-HJKMNP-TV-Z]{26}$"
      },
      "uniqueItems": true
    },
    "engineProfile": {
      "enum": [
        "default-agentic",
        "deterministic-template",
        "quick-engineering"
      ]
    },
    "authoringMode": {
      "enum": [
        "agent-authoring",
        "deterministic-template"
      ]
    },
    "authoringDisclosure": {
      "enum": [
        "agent-authored-editable-draft",
        "template-limited-editable-draft"
      ]
    },
    "suggestedFilename": {
      "type": "string",
      "minLength": 1
    },
    "createdBy": {
      "type": "string",
      "pattern": "^[0-9A-HJKMNP-TV-Z]{26}$"
    },
    "createdAt": {
      "type": "string",
      "format": "date-time"
    }
  },
  "required": [
    "schemaVersion",
    "presentationId",
    "presentationRevisionId",
    "basedOnRevisionId",
    "organizationId",
    "slideVersionIds",
    "acceptedMissingSlideIds",
    "engineProfile",
    "authoringMode",
    "authoringDisclosure",
    "suggestedFilename",
    "createdBy",
    "createdAt"
  ]
}
